{
  "name": "Minecraft",
  "tagline": "One mod for Paper, Fabric and NeoForge servers.",
  "assetMode": "pick-one",
  "requirements": [
    "Takaro registration token"
  ],
  "assets": [
    {
      "pattern": "takaro-minecraft-mod-fabric-26.2-*.jar",
      "label": "Fabric 26.2",
      "requires": "Minecraft 26.2 · Java 25 · Fabric API · Fabric Loader 0.19.5+",
      "hint": "Copy into <server>/mods/, alongside the Fabric API jar.",
      "required": true
    },
    {
      "pattern": "takaro-minecraft-mod-fabric-26.1.2-*.jar",
      "label": "Fabric 26.1.2",
      "requires": "Minecraft 26.1.2 · Java 25 · Fabric API · Fabric Loader 0.19.3+",
      "hint": "Copy into <server>/mods/, alongside the Fabric API jar.",
      "required": true
    },
    {
      "pattern": "takaro-minecraft-mod-fabric-26.3-*.jar",
      "label": "Fabric 26.3",
      "requires": "Minecraft 26.3 · Java 25 · Fabric API · Fabric Loader 0.19.5+",
      "hint": "Copy into <server>/mods/, alongside the Fabric API jar.",
      "required": true
    },
    {
      "pattern": "takaro-minecraft-mod-paper-1.21.11-*.jar",
      "label": "Paper",
      "requires": "Minecraft 1.21.11 · Java 21",
      "hint": "Copy into <server>/plugins/.",
      "required": true
    },
    {
      "pattern": "takaro-minecraft-mod-neoforge-1.21.11-*.jar",
      "label": "NeoForge",
      "requires": "Minecraft 1.21.11 · Java 21 · NeoForge 21.11.45+",
      "hint": "Copy into <server>/mods/.",
      "required": true
    }
  ]
}
