{
  "name": "Project Zomboid",
  "tagline": "Java agent that connects a Project Zomboid Build 42 dedicated server to Takaro.",
  "assetMode": "all",
  "requirements": [
    "Project Zomboid Build 42 dedicated server",
    "Ability to set JAVA_TOOL_OPTIONS or edit vmArgs",
    "Takaro registration token"
  ],
  "assets": [
    {
      "pattern": "takaro-zomboid-linux-*.zip",
      "label": "Connector",
      "hint": "Unzip into <Zomboid data dir>/ so Takaro/TakaroConnector.jar and Takaro/TakaroConfig.txt land there, paste the registration token into TakaroConfig.txt, then load the jar with -javaagent:.",
      "required": true
    },
    {
      "pattern": "TakaroConnector-*.jar",
      "label": "Jar only (upgrades)",
      "hint": "To upgrade, replace Takaro/TakaroConnector.jar with this file, renamed to TakaroConnector.jar.",
      "required": false
    }
  ]
}
