{
  "name": "Conan Exiles",
  "tagline": "Native connector inside the Conan Exiles dedicated server (Linux or Windows): no sidecar, no RCON, no mod.",
  "assetMode": "pick-one",
  "requirements": [
    "Takaro registration token",
    "Conan Exiles dedicated server build 25792439 (or 25738716, 25639945)",
    "Linux: control of the server start command (LD_PRELOAD)"
  ],
  "assets": [
    {
      "pattern": "takaro-conan-exiles-native-linux-*.zip",
      "label": "Linux server",
      "requires": "Conan Exiles Linux dedicated server build 25792439 (or 25738716, 25639945)",
      "hint": "Load libtakaro-conan-native.so with LD_PRELOAD, start the server and paste the token into ConanSandbox/Saved/Config/Takaro/takaro.json; INSTALL.md in the zip has every step.",
      "required": true
    },
    {
      "pattern": "takaro-conan-exiles-native-windows-*.zip",
      "label": "Windows server",
      "requires": "Conan Exiles Windows dedicated server build 25792439 (or 25738716, 25639945)",
      "hint": "Copy winmm.dll next to ConanSandboxServer-Win64-Shipping.exe, start the server and paste the token into ConanSandbox\\Saved\\Config\\Takaro\\takaro.json; INSTALL.md in the zip has every step.",
      "required": true
    }
  ]
}
