{
  "name": "Counter-Strike 2",
  "tagline": "Native server-side CounterStrikeSharp plugin connecting CS2 to Takaro.",
  "assetMode": "all",
  "requirements": [
    "Linux x86-64 Counter-Strike 2 dedicated server build listed in the catalog",
    "Metamod:Source 2.0.0.1483",
    "CounterStrikeSharp 1.0.377 with .NET 10 runtime",
    "Source 2 Viewer CLI 20.1 for local map asset extraction during installation",
    "Takaro registration token"
  ],
  "assets": [
    {
      "pattern": "takaro-counter-strike2-*.zip",
      "label": "Server plugin",
      "hint": "Extract TakaroCs2 into game/csgo/addons/counterstrikesharp/plugins/, prepare maps from the installed CS2 VPKs with the bundled script, and configure the plugin JSON.",
      "required": true
    }
  ]
}
