{
  "name": "RuneScape: Dragonwilds",
  "tagline": "Native connector for a RuneScape: Dragonwilds Linux dedicated server.",
  "assetMode": "all",
  "requirements": [
    "Takaro registration token",
    "Control of the Dragonwilds Linux dedicated server startup command"
  ],
  "assets": [
    {
      "pattern": "takaro-dragonwilds-plugin.tar.gz",
      "label": "Plugin",
      "requires": "Dragonwilds Linux dedicated server",
      "hint": "Load with LD_PRELOAD on the game binary's launch line only; the plugin creates takaro.cfg next to the .so; the archive includes licenses and upgrade instructions.",
      "required": true
    }
  ]
}
