{
  "name": "Enshrouded",
  "tagline": "Native connector for an Enshrouded dedicated server: one dbghelp.dll next to the server exe.",
  "assetMode": "all",
  "requirements": [
    "Takaro registration token",
    "File access to the Enshrouded dedicated server folder"
  ],
  "assets": [
    {
      "pattern": "takaro-enshrouded-plugin.zip",
      "label": "Plugin",
      "requires": "Enshrouded dedicated server (game build 1269579 or 1267041 / Enshrouded 1.0)",
      "hint": "Copy dbghelp.dll next to enshrouded_server.exe and start the server; it creates takaro\\plugin.json, where you paste the registration token (saving is enough, no restart); the zip includes install, upgrade and rollback instructions.",
      "required": true
    }
  ]
}
